{
  "schemaVersion": "ContinuationState 0.1",
  "id": "probe-continuation-31721541661",
  "actor": "probe-engine",
  "status": "IN_PROGRESS",
  "branch": null,
  "prNumber": null,
  "completed": [
    "probe"
  ],
  "remaining": [],
  "nextAction": null,
  "lastKnownGood": {
    "sha": "f08c3e9249611aec77f5cbebf86d5bea96973694",
    "checkpoint": "probe-finished"
  },
  "blockedBy": [],
  "handoffTo": null
}
