{
  "schemaVersion": "ContinuationState 0.1",
  "id": "probe-continuation-31721252864",
  "actor": "probe-engine",
  "status": "DONE",
  "branch": null,
  "prNumber": null,
  "completed": [
    "probe"
  ],
  "remaining": [],
  "nextAction": null,
  "lastKnownGood": {
    "sha": "8baca56324bebe6b6bddeeb5e406311d641d6d15",
    "checkpoint": "probe-finished"
  },
  "blockedBy": [],
  "handoffTo": null
}
