{
  "schemaVersion": "ContinuationState 0.1",
  "id": "probe-continuation-31720863856",
  "actor": "probe-ui",
  "status": "DONE",
  "branch": null,
  "prNumber": null,
  "completed": [
    "probe"
  ],
  "remaining": [],
  "nextAction": null,
  "lastKnownGood": {
    "sha": null,
    "checkpoint": "probe-cleanup"
  },
  "blockedBy": [],
  "handoffTo": null
}
